{
  "schema": "capability-card.v1",
  "civilization_id": "did:zao:estate-01",
  "protocol_versions": [
    "v1.0",
    "zorca-fed-v1"
  ],
  "public_key": {
    "kty": "OKP",
    "crv": "Ed25519",
    "x": "11qYAYKxCrfVS_7TyWQHOg7hcvPapiMlrGwHEJa28pc",
    "kid": "zao-fed-key-2026"
  },
  "capabilities": [
    {
      "capability_id": "cap:code:audit",
      "description": "Deterministic repository syntax, lint, and security analysis",
      "input_schema_hash": "e3b0c44298fc1c149afbf4c8996fb92427ae41e4649b934ca495991b7852b855",
      "output_schema_hash": "ca978112ca1bbdcafac231b39a23dc4da786eff8147c4e72b9807785afee48bb",
      "estimated_settlement_ms": 30000
    },
    {
      "capability_id": "cap:event:telemetry-probe",
      "description": "Independent probe verification for social and event streaming assertions",
      "input_schema_hash": "3e23e8160039594a33894f6564e1b1348bbd7a0088d42c4acb73eeaed59c009d",
      "output_schema_hash": "2e7d2c03a9507ae265ecf5b5356885a53393a2029d24139499726b4259fb778e",
      "estimated_settlement_ms": 15000
    }
  ],
  "accepted_work_packet_types": [
    "packet:audit:v1",
    "packet:verification:v1"
  ],
  "transport_endpoints": [
    {
      "protocol": "HTTPS",
      "uri": "https://nexus.thezao.com/api/federation/v1"
    }
  ],
  "proof_requirements": {
    "minimum_terminal_state": "SUCCESS",
    "evidence_hash_required": true,
    "independent_observer_required": true
  },
  "credential_requirements": [
    "did:dreamnet:passport:v1"
  ],
  "payment_methods": [
    {
      "rail": "BASE_USDC",
      "token": "0x833589fCD6eDb6E08f4c7C32D4f71b54bdA02913",
      "recipient_address": "0x0000000000000000000000000000000000000000"
    }
  ],
  "data_egress_policy": "HASH_ONLY",
  "max_delegation": 1,
  "callback_endpoints": [
    "https://nexus.thezao.com/api/federation/callback"
  ]
}
